<?xml version="1.0" encoding="UTF-8"?>
<!-- edited with XMLSpy v2013 rel. 2 sp2 (x64) (http://www.altova.com) by Bruce Silver (private) -->
<?altova_sps dmn.sps?>
<Definitions id="def01" name="Chapter 11 example" namespace="http://brsilver.com/dmn/test01" xmlns="http://www.omg.org/spec/DMN/20130901" xmlns:tns="http://brsilver.com/dmn/test01" xmlns:feel="http://www.omg.org/spec/FEEL/20140401" xmlns:xsi="http://www.w3.org/2001/XMLSchema-instance" xsi:schemaLocation="http://www.omg.org/spec/DMN/20130901 github%20branches/21.11-67%20DT%20unaryTests%20correction/dmn.xsd">
	<ItemDefinition id="tEligibility" name="tEligibility">
		<typeRef>feel:string</typeRef>
		<allowedValues>"INELIGIBLE", "ELIGIBLE"</allowedValues>
	</ItemDefinition>
	<ItemDefinition id="tBureauCallType" name="tBureauCallType">
		<typeRef>feel:string</typeRef>
		<allowedValues>"FULL", "MINI", "NONE"</allowedValues>
	</ItemDefinition>
	<ItemDefinition id="tStrategy" name="tStrategy">
		<typeRef>feel:string</typeRef>
		<allowedValues>"DECLINE", "BUREAU", "THROUGH"</allowedValues>
	</ItemDefinition>
	<ItemDefinition name="tRiskCategory" id="tRiskCategory">
		<typeRef>feel:string</typeRef>
		<allowedValues>&quot;DECLINE&quot;, &quot;HIGH&quot;, &quot;MEDIUM&quot;, &quot;LOW&quot;, &quot;VERY LOW&quot;</allowedValues>
	</ItemDefinition>
	<ItemDefinition name="tRouting" id="tRouting">
		<typeRef>feel:string</typeRef>
		<allowedValues>&quot;DECLINE&quot;, &quot;REFER&quot;, &quot;ACCEPT&quot;</allowedValues>
	</ItemDefinition>
	<ItemDefinition name="tBureauData">
		<itemComponent name="CreditScore">
			<typeRef>feel:number</typeRef>
			<allowedValues>[0..999], null</allowedValues>
		</itemComponent>
		<itemComponent name="Bankrupt">
			<typeRef>feel:boolean</typeRef>
		</itemComponent>
	</ItemDefinition>
	<ItemDefinition name="tAdjudication" id="tAdjudication">
		<typeRef>feel:string</typeRef>
		<allowedValues>&quot;DECLINE&quot;, &quot;ACCEPT&quot;</allowedValues>
	</ItemDefinition>
	<ItemDefinition name="tApplicantData" id="tApplicantData">
		<itemComponent name="Monthly">
			<itemComponent name="Income">
				<typeRef>feel:number</typeRef>
			</itemComponent>
			<itemComponent name="Expenses">
				<typeRef>feel:number</typeRef>
			</itemComponent>
			<itemComponent name="Repayments">
				<typeRef>feel:number</typeRef>
			</itemComponent>
		</itemComponent>
		<itemComponent name="Age">
			<typeRef>feel:number</typeRef>
		</itemComponent>
		<itemComponent name="ExistingCustomer">
			<typeRef>feel:boolean</typeRef>
		</itemComponent>
		<itemComponent name="MaritalStatus">
			<typeRef>feel:string</typeRef>
			<allowedValues>&quot;S&quot;,&quot;M&quot;</allowedValues>
		</itemComponent>
		<itemComponent name="EmploymentStatus">
			<typeRef>feel:string</typeRef>
			<allowedValues>&quot;EMPLOYED&quot;,&quot;SELF-EMPLOYED&quot;,&quot;STUDENT&quot;,&quot;UNEMPLOYED&quot;</allowedValues>
		</itemComponent>
	</ItemDefinition>
	<ItemDefinition name="tRequestedProduct" id="tRequestedProduct">
		<itemComponent name="ProductType">
			<typeRef>feel:string</typeRef>
			<allowedValues>&quot;STANDARD LOAN&quot;, &quot;SPECIAL LOAN&quot;</allowedValues>
		</itemComponent>
		<itemComponent name="Amount">
			<typeRef>feel:number</typeRef>
		</itemComponent>
		<itemComponent name="Rate">
			<typeRef>feel:number</typeRef>
		</itemComponent>
		<itemComponent name="Term">
			<typeRef>feel:number</typeRef>
		</itemComponent>
	</ItemDefinition>
	<Decision name="BureauCallType" id="d_BureauCallType">
		<InformationItem name="BureauCallType" id="v_BureauCallType" typeRef="tns:tBureauCallType"/>
		<informationRequirement>
			<requiredDecision href="#d_Pre-bureauRiskCategory"/>
		</informationRequirement>
		<knowledgeRequirement>
			<requiredKnowledge href="#b_BureauCallTypeTable"/>
		</knowledgeRequirement>
		<Invocation>
			<binding>
				<LiteralExpression>
					<text>Pre-bureauRiskCategory</text>
				</LiteralExpression>
				<parameter href="#p_Pre-bureauRiskCategory"/>
			</binding>
		</Invocation>
	</Decision>
	<Decision id="d_Strategy" name="Strategy">
		<description>3</description>
		<question>Is credit bureau call required?</question>
		<allowedAnswers>Yes (BUREAU) or No (DECLINE, THROUGH)</allowedAnswers>
		<InformationItem name="Strategy" id="v_Strategy" typeRef="tns:tStrategy"/>
		<informationRequirement>
			<requiredDecision href="#d_BureauCallType"/>
		</informationRequirement>
		<informationRequirement>
			<requiredDecision href="#d_Eligibility"/>
		</informationRequirement>
		<DecisionTable hitPolicy="UNIQUE" isComplete="true" isConsistent="true" preferedOrientation="Rule-as-Row">
			<input name="Eligibility" id="ix_Strategy.Eligibility">
				<inputExpression>
					<text>Eligibility</text>
				</inputExpression>
				<inputValues>"ELIGIBLE", "INELIGIBLE"</inputValues>
			</input>
			<input name="BureauCall" id="ix_Strategy.BureauCall">
				<inputExpression>
					<text>BureauCallType</text>
				</inputExpression>
				<inputValues>"FULL", "MINI", "NONE"</inputValues>
			</input>
			<output name="Strategy"/>
			<rule>
				<inputEntry inputRef="ix_Strategy.Eligibility">"INELIGIBLE"</inputEntry>
				<inputEntry inputRef="ix_Strategy.BureauCall">-</inputEntry>
				<outputEntry>
					<text>"DECLINE"</text>
				</outputEntry>
			</rule>
			<rule>
				<inputEntry inputRef="ix_Strategy.Eligibility">"ELIGIBLE"</inputEntry>
				<inputEntry inputRef="ix_Strategy.BureauCall">"FULL","MINI"</inputEntry>
				<outputEntry>
					<text>"BUREAU"</text>
				</outputEntry>
			</rule>
			<rule>
				<inputEntry inputRef="ix_Strategy.Eligibility">"ELIGIBLE"</inputEntry>
				<inputEntry inputRef="ix_Strategy.BureauCall">"NONE"</inputEntry>
				<outputEntry>
					<text>"THROUGH"</text>
				</outputEntry>
			</rule>
		</DecisionTable>
	</Decision>
	<Decision id="d_Eligibility" name="Eligibility">
		<InformationItem name="Eligibility" id="v_Eligibility" typeRef="tns:tEligibility"/>
		<informationRequirement>
			<requiredDecision href="#d_Pre-bureauRiskCategory"/>
		</informationRequirement>
		<informationRequirement>
			<requiredInput href="#i_ApplicantData"/>
		</informationRequirement>
		<informationRequirement>
			<requiredDecision href="#d_Pre-bureauAffordability"/>
		</informationRequirement>
		<knowledgeRequirement>
			<requiredKnowledge href="#b_EligibilityRules"/>
		</knowledgeRequirement>
		<Invocation>
			<binding>
				<LiteralExpression>
					<text>Pre-bureau Affordability</text>
				</LiteralExpression>
				<parameter href="#p_EligibilityRules.Pre-bureauAffordability"/>
			</binding>
			<binding>
				<LiteralExpression>
					<text>Pre-bureau Risk Category</text>
				</LiteralExpression>
				<parameter href="#p_EligibilityRules.Pre-bureauRiskCategory"/>
			</binding>
			<binding>
				<LiteralExpression>
					<text>Applicant Data.Age</text>
				</LiteralExpression>
				<parameter href="#p_EligibilityRules.Age"/>
			</binding>
		</Invocation>
	</Decision>
	<Decision name="Pre-bureauRiskCategory" id="d_Pre-bureauRiskCategory">
		<InformationItem name="Pre-bureauRiskCategory" typeRef="tns:tRiskCategory" id="v_Pre-bureauRiskCategory"/>
		<informationRequirement>
			<requiredDecision href="#d_ApplicationRiskScore"/>
		</informationRequirement>
		<informationRequirement>
			<requiredInput href="#i_ApplicantData"/>
		</informationRequirement>
		<knowledgeRequirement>
			<requiredKnowledge href="#b_Pre-bureauRiskCategoryTable"/>
		</knowledgeRequirement>
		<Invocation>
			<binding>
				<LiteralExpression>
					<text>ApplicantData.ExistingCustomer</text>
				</LiteralExpression>
				<parameter href="#p_Pre-bureauRiskCategoryTable.ExistingCustomer"/>
			</binding>
			<binding>
				<LiteralExpression>
					<text>ApplicationRiskScore</text>
				</LiteralExpression>
				<parameter href="#p_Pre-bureauRiskCategoryTable.ApplicationRiskScore"/>
			</binding>
		</Invocation>
	</Decision>
	<Decision name="Post-bureauRiskCategory" id="d_Post-bureauRiskCategory">
		<InformationItem name="Post-bureauRiskCategory" id="v_Post-bureauRiskCategory" typeRef="tns:tRiskCategory"/>
		<informationRequirement>
			<requiredInput href="#i_ApplicantData"/>
		</informationRequirement>
		<informationRequirement>
			<requiredDecision href="#d_ApplicationRiskScore"/>
		</informationRequirement>
		<informationRequirement>
			<requiredInput href="#i_BureauData"/>
		</informationRequirement>
		<knowledgeRequirement>
			<requiredKnowledge href="#b_Post-bureauRiskCategoryTable"/>
		</knowledgeRequirement>
		<Invocation>
			<binding>
				<LiteralExpression>
					<text>ApplicantData.ExistingCustomer</text>
				</LiteralExpression>
				<parameter href="#p_Post-bureauRiskCategoryTable.ExistingCustomer"/>
			</binding>
			<binding>
				<LiteralExpression>
					<text>BureauData.CreditScore</text>
				</LiteralExpression>
				<parameter href="#p_Post-bureauRiskCategoryTable.CreditScore"/>
			</binding>
			<binding>
				<LiteralExpression>
					<text>ApplicationRiskScore</text>
				</LiteralExpression>
				<parameter href="#p_Post-bureauRiskCategoryTable.ApplicationRiskScore"/>
			</binding>
		</Invocation>
	</Decision>
	<Decision name="ApplicationRiskScore" id="d_ApplicationRiskScore">
		<InformationItem name="ApplicationRiskScore" typeRef="feel:number" id="v_ApplicationRiskScore"/>
		<informationRequirement>
			<requiredInput href="#i_ApplicantData"/>
		</informationRequirement>
		<knowledgeRequirement>
			<requiredKnowledge href="#b_ApplicationRiskScoreModel"/>
		</knowledgeRequirement>
		<Invocation>
			<binding>
				<LiteralExpression>
					<text>ApplicantData.Age</text>
				</LiteralExpression>
				<parameter href="#p_ApplicationRiskScoreModel.Age"/>
			</binding>
			<binding>
				<LiteralExpression>
					<text>ApplicantData.MaritalStatus</text>
				</LiteralExpression>